Ontology ID	label	parent class	Definition distilled from the GCW synthesis work	Definition's database cross reference	comment	Comment's database cross reference	editors note	exact synonym	broad synonym	narrow synonym	related synonym	in subset	SWEET cross reference	general cross reference	subclass axiom	creation date	created by
ID	AL rdfs:label@en	SC %	AL IAO:0000115@en	>AI oboInOwl:hasDbXref SPLIT=|	AL rdfs:comment@en	>AI oboInOwl:hasDbXref SPLIT=|	AL IAO:0000116@en	AL oboInOwl:hasExactSynonym@en SPLIT=|	AL oboInOwl:hasBroadSynonym@en SPLIT=|	AL oboInOwl:hasNarrowSynonym@en SPLIT=|	AL oboInOwl:hasRelatedSynonym@en SPLIT=|	A oboInOwl:inSubset SPLIT=|	AI oboInOwl:hasDbXref	AI oboInOwl:hasDbXref SPLIT=|	SC % SPLIT=|	AT oboInOwl:creation_date^^xsd:dateTime	AI oboInOwl:created_by SPLIT=|
ENVO:01000818							obsolete this term. Replace by new term for planetary cryosphere.					envoPolar|envoCryo				2021-04-14T18:57:18.275Z	https://orcid.org/0000-0003-4808-4736|http://orcid.org/0000-0002-4366-3088|http://orcid.org/0000-0002-3410-4655|https://orcid.org/0000-0003-0632-7576|https://orcid.org/0000-0002-0337-8610|https://orcid.org/0000-0002-2282-7215|https://orcid.org/0000-0002-2908-3327
ENVO:03000143	cryosphere	astronomical body part	An astronomical body part which is composed primarily of environmental materials in their frozen form.	https://orcid.org/0000-0003-4808-4736	The term refers collectively to the portions of the earth (i.e., a planet) where water is in solid form, including snow cover, floating ice, glaciers, ice caps, ice sheets, seasonally frozen ground and perennially frozen ground (permafrost). The Cryosphere may be divided into the cryoatmosphere, the cryohydrosphere (snow cover, glaciers, and river, lake and sea Ice) and the cryolithosphere (perennially and seasonally cryotic ground, rock glacier).   This is an Earth centric definition, other cryospheres will be considered later. Some definitions reffer to that which is sufficiently cold for pure water to freeze for at least a part of each year.  It should be noted that "Some authorities exclude the earth's atmosphere from the Earth's Cryosphere; others restrict the term Cryosphere to the regions of the earth's crust where Permafrost exists."  Definitions of Cryosphere come from several glossaries including: - PhysicalGeography.net http://physicalgeography.net/ -  van Everdingen, Robert, ed., 2005 (1998 revised May 2005). Multi-language glossary of permafrost and related ground-ice terms. Boulder, CO: National Snow and Ice Data Center/World Data Center for Glaciology. [https://globalcryospherewatch.org/reference/glossary_docs/Glossary_of_Permafrost_and_Ground-Ice_IPA_2005.pdf] - American Meteorological Society, 2015. Glossary of Meteorology [online], Available at: http://glossary.ametsoc.org/wiki/Main_Page. [Accessed 27/01/2017]. - EU Climate-ADAPT (The European Climate Adaptation Platform), no date, Glossary, Available from: http://climate-adapt.eea.europa.eu/glossary - IPCC, 2014: Annex II: Glossary [Agard, J., Schipper, E. L. F., (ed.)]. In: Climate Change 2014: Impacts, Adaptation, and Vulnerability. Contribution of Working Group II to the Fifth Assessment Report of the Intergovernmental Panel on Climate Change [Birkmann, J., Campos, M., Dubeux, C., Nojiri, Y., Olsson, L., Osman-Elasha, B., Pelling, M., Prather, M. J., Rivera-Ferre M. G., Ruppel, O. C., Sallenger, A., Smith, K. R., St. Clair, A. L.,]. Cambridge University Press, Cambridge, United Kingdom and New York, NY, USA. [Link] - NSIDC, The National Snow and Ice Data Center glossary is available at https://nsidc.org/cryosphere/glossary, Last accessed [26/01/2016]. - Trombotto, D., P. Wainstein & L. Arenson, 2014, Guía Terminológica de la Geocriología Sudamericana” / “Terminological Guide of the South American Geocryology, 1a ed. 128 pp. [Link] - UNESCO-WMO, 2012, International Glossary of Hydrology, 3rd edition, WMO-No. 385. [Link]	https://orcid.org/0000-0003-4808-4736	For the moment the definition links to liquid water but in the future we might need to link to other materials for other planets, e.g., Mars. Need to make this planet agnostic. Might want to not have the definition link to years as some astronomical body parts might not be in systems with years.   Make an axiom with composed primairly of frozen environmental materials. 					envoPolar|envoCryo	http://sweetontology.net/realm/Cryosphere			2021-04-14T18:57:18.275Z	https://orcid.org/0000-0003-4808-4736|http://orcid.org/0000-0002-4366-3088|http://orcid.org/0000-0002-3410-4655|https://orcid.org/0000-0003-0632-7576|https://orcid.org/0000-0002-0337-8610|https://orcid.org/0000-0002-2282-7215|https://orcid.org/0000-0002-2908-3327
ENVO:03000144	planetary cryosphere	ENVO:03000143	A cryosphere which is part of a planet.				Replacement for ENVO:01000818					envoPolar|envoCryo				2021-04-14T18:57:18.275Z	https://orcid.org/0000-0003-4808-4736|http://orcid.org/0000-0002-4366-3088|http://orcid.org/0000-0002-3410-4655|https://orcid.org/0000-0003-0632-7576|https://orcid.org/0000-0002-0337-8610|https://orcid.org/0000-0002-2282-7215|https://orcid.org/0000-0002-2908-3327
ENVO:00000484		 sea surface layer	A sea surface layer which is 1) not covered by ice and 2) completely surrounded by either pack ice or land and pack ice.	https://orcid.org/0000-0003-4808-4736	A polynya is a Russian term for any non-linear shaped area of open water within the ice pack. Polynyas may contain brash ice and/or be covered with new ice, nilas or young ice; submariners refer to these as skylights.   Sometimes the polynya is limited on one side by the coast and is called a shore polynya or by fast ice and is called a flaw polynya. If it recurs in the same position every year, e.g. off the mouths of big rivers, it is called a recurring polynya. A temporary small clearing in pack ice which consists of small floes and brash in continuous local movement is called an unstable polynya; an opening which is flanked by large floes and therefore appears to be relatively stable is called a stable polynya.   Polynyas range in size from relatively small to enormous. The largest polynya observed in the Antarctic was the Weddell Polynya of 1975-77, covering an area of 2x105km2.   The two main categories of polynya are sensible heat and latent heat, depending on the mechanism responsible for maintaining their presence. Latent heat polynyas are maintained by persistent katabatic winds that drain off the continent. Newly formed ice is advected away by the wind, leaving the surface ice-free and open to more ice formation. In this manner latent heat polynyas can be major sources of new ice production. Coastal polynyas are primarily of this type. Sensible heat polynyas are maintained by upwelling warm water that supplies a sufficiently large oceanic heat flux to the base of the ice to reduce its thickness, or melt it completely. These polynyas are not responsible for large quantities of new ice production. A polynya may also form by a combination of the sensible and latent heat processes.   From the remote sensing/sea ice standpoint a polynya is a hole in the ice that ordinarily wouldn't be there - except that either the wind is creating it by pushing the ice away or there is something under the ice that is warmer than its surroundings and melting the ice that would otherwise be there.	https://orcid.org/0000-0003-4808-4736	Remove old defintion: "Any enclosed water area in pack ice other than a lead ..."  Remove old superclass lentic water body 	Polyn'ya				envoCryo	http://sweetontology.net/realmOcean/Polynya			2021-04-14T18:57:18.275Z	https://orcid.org/0000-0003-4808-4736|http://orcid.org/0000-0002-4366-3088|http://orcid.org/0000-0002-3410-4655|https://orcid.org/0000-0003-0632-7576|https://orcid.org/0000-0002-0337-8610|https://orcid.org/0000-0002-2282-7215|https://orcid.org/0000-0002-2908-3327
ENVO:03000141	snow layer	cryospheric layer	A cryospheric layer which is primarily composed of snow.	https://orcid.org/0000-0003-4808-4736	Follows from the GCW's snow cover definition 2: In general, a layer of snow on the ground surface. Compare snowfield, snowpack.   Given the SWEET terms location in its heirarchy I think only the 3rd definition is meant.	https://orcid.org/0000-0003-4808-4736	1) Add an axioms about A cryospheric layer which is primairly composed of snow.  2) Make a thickness of snow class using the Entity attribute DOSDP. thickness and inhers in some cryospheric layer. That class refers to GCW snow cover definition 3: The depth of snow on the ground, usually expressed in inches or centimeters. Link depth of snow to http://sweetontology.net/propSpaceThickness/SnowCover  3) We might want to make 3 class for ice cover which replicate the patterns used here for the GCW snow cover. Classes such as 1) Area of ice cover 2) ice layer 3) Depth of ice.				snow cover	envoPolar|envoCryo	http://sweetontology.net/propSpaceThickness/SnowCover			2021-04-14T18:57:18.275Z	https://orcid.org/0000-0003-4808-4736|http://orcid.org/0000-0002-4366-3088|http://orcid.org/0000-0002-3410-4655|https://orcid.org/0000-0003-0632-7576|https://orcid.org/0000-0002-0337-8610|https://orcid.org/0000-0002-2282-7215|https://orcid.org/0000-0002-2908-3327
ENVO:03000145	area of snow cover	environmental zone	An environmental zone which is covered or partially covered by snow.	https://orcid.org/0000-0003-4808-4736	This is one of three classes representing the idea of snow cover in the GCW glossary in addition to depth of snow and snow cover. In the GCW this refers to 1. The areal extent of snow-covered ground, usually expressed as percent of total area in a given region.	https://orcid.org/0000-0003-4808-4736						envoPolar|envoCryo				2021-04-14T18:57:18.275Z	https://orcid.org/0000-0003-4808-4736|http://orcid.org/0000-0002-4366-3088|http://orcid.org/0000-0002-3410-4655|https://orcid.org/0000-0003-0632-7576|https://orcid.org/0000-0002-0337-8610|https://orcid.org/0000-0002-2282-7215|https://orcid.org/0000-0002-2908-3327
ENVO:03000142	snow water equivalent	PATO:0001595	A depth which inheres in a layer of liquid water derived from the complete melting a mass of snow contained in an area.	https://orcid.org/0000-0003-4808-4736	The quantification of snow water equivalent can be done through direct melting of snow in a defined area, or through the derivation of such a value from the processing of remote sensing data of, e.g., snow density and coverage.		In an area of melted snow it's the thickness of acumulated water. This involves a processing step for measurement, may be more appropriate in OBI (if it extends beyond biomedicine). 					envoPolar|envoCryo	http://sweetontology.net/propSpaceThickness/SnowWaterEquivalent			2021-04-14T18:57:18.275Z	https://orcid.org/0000-0003-4808-4736|http://orcid.org/0000-0002-4366-3088|http://orcid.org/0000-0002-3410-4655|https://orcid.org/0000-0003-0632-7576|https://orcid.org/0000-0002-0337-8610|https://orcid.org/0000-0002-2282-7215|https://orcid.org/0000-0002-2908-3327
ENVO:03000116	snowpack	ENVO:03000111	A snow mass which is large enough, and persists long enough, to undergo compaction under its own weight, leading to layer-like structural differentiation.	https://en.wikipedia.org/wiki/Snowpack	The GCW analysis of multiple glossaries found eight definitions of snowpack, with many commonalities but also disagreements. Please see the corresponding report "WMO GCW Nomenclature Assessment" for more information.		Given that SWEET considers the term to be a thickness and ENVO currently considers it a mass of snow; I think we have a fundamental mismatch here. See https://github.com/ESIPFed/sweet/issues/236#issue-805822974.	snow pack				envoPolar|envoCryo	http://sweetontology.net/propSpaceThickness/Snowpack			2021-04-14T18:57:18.275Z	https://orcid.org/0000-0003-4808-4736|http://orcid.org/0000-0002-4366-3088|http://orcid.org/0000-0002-3410-4655|https://orcid.org/0000-0003-0632-7576|https://orcid.org/0000-0002-0337-8610|https://orcid.org/0000-0002-2282-7215|https://orcid.org/0000-0002-2908-3327
ENVO:3400003	snow cover	PATO:0001351	An area density which inheres in snow distributed over an area of a landmass or other substrate.		1. The areal extent of snow-covered ground, usually expressed as percent of total area in a given region. 2. In general, a layer of snow on the ground surface. Compare snowfield, snowpack. 3. The depth of snow on the ground, usually expressed in inches or centimeters.		The superclass "area density" is somewhat awkward and this positioning requires further discussion.					envoPolar|envoCryo	http://sweetontology.net/phenHydro/SnowCover			2021-04-14T18:57:18.275Z	https://orcid.org/0000-0003-4808-4736|http://orcid.org/0000-0002-4366-3088|http://orcid.org/0000-0002-3410-4655|https://orcid.org/0000-0003-0632-7576|https://orcid.org/0000-0002-0337-8610|https://orcid.org/0000-0002-2282-7215|https://orcid.org/0000-0002-2908-3327
ENVO:09200020							Make sure to make the DOSDP target for this term:  https://github.com/EnvironmentOntology/envo/blob/master/src/envo/modules/entity_attribute.csv#L18				snow cover	envoPolar|envoCryo	http://sweetontology.net/phenHydro/SnowCover			2021-04-14T18:57:18.275Z	https://orcid.org/0000-0003-4808-4736|http://orcid.org/0000-0002-4366-3088|http://orcid.org/0000-0002-3410-4655|https://orcid.org/0000-0003-0632-7576|https://orcid.org/0000-0002-0337-8610|https://orcid.org/0000-0002-2282-7215|https://orcid.org/0000-0002-2908-3327
ENVO:01000896		water-based rainfall	Water-based rainfall which freezes either 1) on impact with a surface to form a coating of clear ice (glaze) or 2) after percolating through surface layers.  	https://orcid.org/0000-0003-4808-4736	A surface temperature inversion is usually required. In such an inversion, the surface must have a temperature below freezing, while the temperature of the atmosphere where the precipitation forms is above freezing. Alternately, if the temperature of the ground surface and glazed objects is typically near or below freezing (0C or 32F), it is necessary that the water drops be supercooled before striking. Freezing rain can sometimes occur on surfaces exposed to the air (such as tree limbs) with air temperatures slightly above freezing in strong winds. Local evaporational cooling may result in freezing. Freezing rain frequently occurs, therefore, as a transient condition between the occurrence of rain and ice pellets (sleet). When encountered by an aircraft in flight, freezing rain can cause a dangerous accretion of clear icing. In aviation weather observations, this hydrometeor is encoded ZR by NOAA.	https://orcid.org/0000-0003-4808-4736	This term exists, we're revising the definition with ESIP semantic Harmonization group, delete the old one.   Consider adding axioms like PATO:"decreased temperature" to this and other cold forms of precipitation, such that we can create a grouping class to be filled by inference (with hail, sleet, snow, freezing rain). Something like precipitation below the liquid-solid phase transition point of water.					envoPolar|envoCryo	http://sweetontology.net/phenAtmoPrecipitation/FreezingRain			2021-04-14T18:57:18.275Z	https://orcid.org/0000-0003-4808-4736|http://orcid.org/0000-0002-4366-3088|http://orcid.org/0000-0002-3410-4655|https://orcid.org/0000-0003-0632-7576|https://orcid.org/0000-0002-0337-8610|https://orcid.org/0000-0002-2282-7215|https://orcid.org/0000-0002-2908-3327
ENVO:3400010	freezing rain	water-based rain	Water-based rain which is composed of supercooled water droplets, which freeze on contact with surfaces. 		There are communities which consider rain with droplets above the liquid-solid phase transition point of water to be freezing rain should they freeze on contact with a supercooled surface. 							envoPolar|envoCryo	http://sweetontology.net/phenAtmoPrecipitation/FreezingRain			2021-04-14T18:57:18.275Z	https://orcid.org/0000-0003-4808-4736|http://orcid.org/0000-0002-4366-3088|http://orcid.org/0000-0002-3410-4655|https://orcid.org/0000-0003-0632-7576|https://orcid.org/0000-0002-0337-8610|https://orcid.org/0000-0002-2282-7215|https://orcid.org/0000-0002-2908-3327
ENVO:3400011	hail	object aggregate	Precipitation which is composed primarily of hail stones.	https://orcid.org/0000-0003-4808-4736	Individual units of hail are called hailstones. Thunderstorms that are characterized by strong updrafts, large liquid water contents, large cloud-drop sizes, and great vertical height are favorable to hail formation. The destructive effects of hailstorms upon plant and animal life, buildings and property, and aircraft in flight render them a prime object of weather modification studies. In aviation weather observations, hail is encoded A. Smaller particles of similar origin, formerly called small hail, may be classed as either ice pellets or snow pellets.	https://orcid.org/0000-0003-4808-4736						envoPolar|envoCryo	http://sweetontology.net/phenAtmoPrecipitation/FreezingRain			2021-04-14T18:57:18.275Z	https://orcid.org/0000-0003-4808-4736|http://orcid.org/0000-0002-4366-3088|http://orcid.org/0000-0002-3410-4655|https://orcid.org/0000-0003-0632-7576|https://orcid.org/0000-0002-0337-8610|https://orcid.org/0000-0002-2282-7215|https://orcid.org/0000-0002-2908-3327
ENVO:3400012	hail stone	ice mass	An ice mass which is in a ball-shape or irregular lump, with a diameter ranging from 5 to 50 millimeters (0.2 to 2.0 inches) or more, always produced by convective clouds, nearly always cumulonimbus. 									envoPolar|envoCryo				2021-04-14T18:57:18.275Z	https://orcid.org/0000-0003-4808-4736|http://orcid.org/0000-0002-4366-3088|http://orcid.org/0000-0002-3410-4655|https://orcid.org/0000-0003-0632-7576|https://orcid.org/0000-0002-0337-8610|https://orcid.org/0000-0002-2282-7215|https://orcid.org/0000-0002-2908-3327
ENVO:3400013	falling snow	object aggregate	An object aggregate composed primarily of ice crystals falling through an atmosphere.						snowfall			envoPolar|envoCryo				2021-04-14T18:57:18.275Z	https://orcid.org/0000-0003-4808-4736|http://orcid.org/0000-0002-4366-3088|http://orcid.org/0000-0002-3410-4655|https://orcid.org/0000-0003-0632-7576|https://orcid.org/0000-0002-0337-8610|https://orcid.org/0000-0002-2282-7215|https://orcid.org/0000-0002-2908-3327
ENVO:01000895												envoPolar|envoCryo	http://sweetontology.net/phenAtmoPrecipitation/Snowfall			2021-04-14T18:57:18.275Z	https://orcid.org/0000-0003-4808-4736|http://orcid.org/0000-0002-4366-3088|http://orcid.org/0000-0002-3410-4655|https://orcid.org/0000-0003-0632-7576|https://orcid.org/0000-0002-0337-8610|https://orcid.org/0000-0002-2282-7215|https://orcid.org/0000-0002-2908-3327
ENVO:01000880			An atmospheric storm during which intense hailfall occurs 	https://glossary.ametsoc.org/wiki/Hailstorm								envoPolar|envoCryo	http://sweetontology.net/phenAtmoPrecipitation/HailStorm			2021-04-14T18:57:18.275Z	https://orcid.org/0000-0003-4808-4736|http://orcid.org/0000-0002-4366-3088|http://orcid.org/0000-0002-3410-4655|https://orcid.org/0000-0003-0632-7576|https://orcid.org/0000-0002-0337-8610|https://orcid.org/0000-0002-2282-7215|https://orcid.org/0000-0002-2908-3327
ENVO:3400004	heavy snowfall	snowfall	Snowfall which has an increased rate.	https://w1.weather.gov/glossary/index.php?word=HEAVY+SNOW	This generally means snowfall accumulating to 4 inches or more in depth in 12 hours or less; or snowfall accumulating to 6 inches or more in depth in 24 hours or less. In forecasts, snowfall amounts are expressed as a range of values, e.g., "8 to 12 inches." However, in heavy snow situations where there is considerable uncertainty concerning the range of values, more appropriate phrases are used, such as "...up to 12 inches..." or alternatively "...8 inches or more...".	https://w1.weather.gov/glossary/index.php?word=HEAVY+SNOW		intense snowfall			heavy snow|intense snow	envoPolar|envoCryo	http://sweetontology.net/phenAtmoPrecipitation/HeavySnowfall			2021-04-14T18:57:18.275Z	https://orcid.org/0000-0003-4808-4736|http://orcid.org/0000-0002-4366-3088|http://orcid.org/0000-0002-3410-4655|https://orcid.org/0000-0003-0632-7576|https://orcid.org/0000-0002-0337-8610|https://orcid.org/0000-0002-2282-7215|https://orcid.org/0000-0002-2908-3327
ENVO:3400005	ice pellet	ice mass	An ice mass which is 1) transparent or translucent, 2) small, and rounded, spherically, or cylindrically shaped, and 3) less than 5 mm in diameter. 	https://orcid.org/0000-0003-4808-4736	They may be spherical, irregular, or (rarely) conical in shape. Ice pellets usually bounce when hitting hard ground and make a sound upon impact. They can fall as continuous precipitation or in showers. Now internationally recognized, ice pellets includes two basically different types of precipitation, known in the United States as 1) sleet or grains of ice, generally transparent, globular, solid grains of ice that have formed from the freezing of raindrops or the refreezing of largely melted snowflakes when falling through a below-freezing layer of air near the earth's surface; and 2) small hail, generally translucent particles, consisting of snow pellets encased in a thin layer of ice. The ice layer may form either by the accretion of droplets upon the snow pellet or by the melting and refreezing of the surface of the snow pellet.	https://orcid.org/0000-0003-4808-4736					grain of ice|ice grain|sleet|small hail	envoPolar|envoCryo	http://sweetontology.net/phenAtmoPrecipitation/IcePellet			2021-04-14T18:57:18.275Z	https://orcid.org/0000-0003-4808-4736|http://orcid.org/0000-0002-4366-3088|http://orcid.org/0000-0002-3410-4655|https://orcid.org/0000-0003-0632-7576|https://orcid.org/0000-0002-0337-8610|https://orcid.org/0000-0002-2282-7215|https://orcid.org/0000-0002-2908-3327
ENVO:01000882			An atmospheric storm during which freezing rain falls and accumulates as ice on exposed surfaces.  	https://orcid.org/0000-0003-4808-4736	Icestorms are associated with multiple hazards. Significant accumulations of ice pull down trees and utility lines resulting in loss of power and communication. These accumulations of ice make walking and driving extremely dangerous. Significant ice accumulations are usually accumulations of 0.25 inch or 0.60 cm or more. Has synonyms silver storm, glaze storm.	https://orcid.org/0000-0003-4808-4736	Note it is a hazard, could perhaps later link to https://github.com/Vocamp/Hazard or https://github.com/Vocamp/Hazard/blob/master/concept-map/ModifiedHazardousSituation.png  and https://github.com/SDG-InterfaceOntology/sdgio/issues/14 	ice storm|glaze storm|silver storm			glaze event|silver thaw	envoPolar|envoCryo	http://sweetontology.net/phenAtmoPrecipitation/IceStorm			2021-04-14T18:57:18.275Z	https://orcid.org/0000-0003-4808-4736|http://orcid.org/0000-0002-4366-3088|http://orcid.org/0000-0002-3410-4655|https://orcid.org/0000-0003-0632-7576|https://orcid.org/0000-0002-0337-8610|https://orcid.org/0000-0002-2282-7215|https://orcid.org/0000-0002-2908-3327
ENVO:3400006	lake-effect snowfall	snowfall	Snowfall which 1) is localized, 2) is convective, and 3) occurs as a result of a cold, dry air mass flowing over a lake with warmer waters and absorbing heat and moisture.	https://orcid.org/0000-0003-4808-4736	The formation of lake-effect snow depends on multiple factors, effecting the thresholds of temperature needed in the air and water masses. In the United States this phenomenon is most noted along the south and east shores of the Great Lakes during arctic cold-air outbreaks.	https://orcid.org/0000-0003-4808-4736|https://en.wikipedia.org/wiki/Lake-effect_snow 	The factors involved in this process are complex, and expert input is needed to refine this. Similar input is needed to create bay-effect and ocean-effect snow.   @Brandon: add axioms to relate this concept to proximity to a `lake`; perhaps using colocation and spatial region?	lake effect snow|lake-effect snow				envoPolar|envoCryo	http://sweetontology.net/phenAtmoPrecipitation/LakeEffectSnow			2021-04-14T18:57:18.275Z	https://orcid.org/0000-0003-4808-4736|http://orcid.org/0000-0002-4366-3088|http://orcid.org/0000-0002-3410-4655|https://orcid.org/0000-0003-0632-7576|https://orcid.org/0000-0002-0337-8610|https://orcid.org/0000-0002-2282-7215|https://orcid.org/0000-0002-2908-3327
ENVO:3400007	lake-effect snow storm	snowstorm	A snowstorm which is an intense form of lake-effect snowfall.	https://orcid.org/0000-0003-4808-4736	Please see "lake-effect snowfall" for further definition. A lake effect snowstorm is a snowstorm occurring near or downwind from the shore of a lake resulting from the warming (destabilization) and moistening of relatively cold air during passage over a warm body of water.	https://orcid.org/0000-0003-4808-4736	Add axioms to nest the lake-effect snowfall process in this one	lake effect snow storm				envoPolar|envoCryo	http://sweetontology.net/phenAtmoPrecipitation/LakeEffectSnowstorm			2021-04-14T18:57:18.275Z	https://orcid.org/0000-0003-4808-4736|http://orcid.org/0000-0002-4366-3088|http://orcid.org/0000-0002-3410-4655|https://orcid.org/0000-0003-0632-7576|https://orcid.org/0000-0002-0337-8610|https://orcid.org/0000-0002-2282-7215|https://orcid.org/0000-0002-2908-3327
ENVO:3400008	lambing storm	snowfall	A snowfall which occurs during springtime and is of low intensity.	https://glossary.ametsoc.org/wiki/Lambing_storm	This term is primarily used in England and refers to snowfall in lambing season. It is referred to as a "storm" as it may adversly affect or kill newborn lambs.	https://glossary.ametsoc.org/wiki/Lambing_storm	Link this to spring once seasons are added to ENVO	lamb-blasts|lamb-showers|lamb storm				envoPolar|envoCryo	http://sweetontology.net/phenAtmoPrecipitation/LambingStorm			2021-04-14T18:57:18.275Z	https://orcid.org/0000-0003-4808-4736|http://orcid.org/0000-0002-4366-3088|http://orcid.org/0000-0002-3410-4655|https://orcid.org/0000-0003-0632-7576|https://orcid.org/0000-0002-0337-8610|https://orcid.org/0000-0002-2282-7215|https://orcid.org/0000-0002-2908-3327
